### DISCUSSION TITLE
HA fails to connect. Please fix this!

### DISCUSSION THREAD

**Discussion by BigDaddyKalash47** [timmo001/system-bridge#2903] [Help] [answered]
title says it all.  I get a "Failed to connect"

**Comment by dwardu89** [comment]
@BigDaddyKalash47 this is free software provided by someone probably working in his spare time.
So if you are able to fix it, then do so, otherwise wait.

I've had this problem as well, and have looked at the error logs on the `systembridge side`

When home assistant tries to connect to the websocket it looks like there might be some mismatch, it might be expecting a token. This is an error log taken from `journalctl -u systembridge`

```
Mar 18 15:41:30 ubuntu-box systembridge[873]: 2024-03-18 15:41:30 ERROR (MainThread) [uvicorn.error] Exception in ASGI application
Mar 18 15:41:30 ubuntu-box systembridge[873]: 
Mar 18 15:41:30 ubuntu-box systembridge[873]: Traceback (most recent call last):
Mar 18 15:41:30 ubuntu-box systembridge[873]:   File "uvicorn/protocols/websockets/websockets_impl.py", line 255, in run_asgi
Mar 18 15:41:30 ubuntu-box systembridge[873]:   File "uvicorn/middleware/proxy_headers.py", line 84, in __call__
Mar 18 15:41:30 ubuntu-box systembridge[873]:   File "fastapi/applications.py", line 1054, in __call__
Mar 18 15:41:30 ubuntu-box systembridge[873]:   File "starlette/applications.py", line 123, in __call__
Mar 18 15:41:30 ubuntu-box systembridge[873]:   File "starlette/middleware/errors.py", line 151, in __call__
Mar 18 15:41:30 ubuntu-box systembridge[873]:   File "starlette/middleware/cors.py", line 75, in __call__
Mar 18 15:41:30 ubuntu-box systembridge[873]:   File "starlette/middleware/exceptions.py", line 62, in __call__
Mar 18 15:41:30 ubuntu-box systembridge[873]:   File "starlette/_exception_handler.py", line 64, in wrapped_app
Mar 18 15:41:30 ubuntu-box systembridge[873]:   File "starlette/_exception_handler.py", line 53, in wrapped_app
Mar 18 15:41:30 ubuntu-box systembridge[873]:   File "starlette/routing.py", line 758, in __call__
Mar 18 15:41:30 ubuntu-box systembridge[873]:   File "starlette/routing.py", line 778, in app
Mar 18 15:41:30 ubuntu-box systembridge[873]:   File "starlette/routing.py", line 375, in handle
Mar 18 15:41:30 ubuntu-box systembridge[873]:   File "starlette/routing.py", line 98, in app
Mar 18 15:41:30 ubuntu-box systembridge[873]:   File "starlette/_exception_handler.py", line 64, in wrapped_app
Mar 18 15:41:30 ubuntu-box systembridge[873]:   File "starlette/_exception_handler.py", line 53, in wrapped_app
Mar 18 15:41:30 ubuntu-box systembridge[873]:   File "starlette/routing.py", line 96, in app
Mar 18 15:41:30 ubuntu-box systembridge[873]:   File "fastapi/routing.py", line 348, in app
Mar 18 15:41:30 ubuntu-box systembridge[873]:   File "systembridgebackend/server/api.py", line 217, in websocket_endpoint
Mar 18 15:41:30 ubuntu-box systembridge[873]:     await websocket_handler.handler()
Mar 18 15:41:30 ubuntu-box systembridge[873]:   File "systembridgebackend/server/websocket.py", line 1021, in handler
Mar 18 15:41:30 ubuntu-box systembridge[873]:     await self._handler(listener_id)
Mar 18 15:41:30 ubuntu-box systembridge[873]:   File "systembridgebackend/server/websocket.py", line 956, in _handler
Mar 18 15:41:30 ubuntu-box systembridge[873]:     request = Request(**data)
Mar 18 15:41:30 ubuntu-box systembridge[873]:               ^^^^^^^^^^^^^^^
Mar 18 15:41:30 ubuntu-box systembridge[873]: TypeError: Request.__init__() got an unexpected keyword argument 'api_key'
```


I think homeassistant is sending the `api_token` instead of a `token` value, when connecting to the web socket.

Currently have `systembridge` `v4.0.4` installed. 

I'm going to try install `v4.0.3`  since theres this open https://github.com/timmo001/system-bridge/issues/2899

**Comment by timmo001** [comment]
System Bridge 4.x.x will be supported in the next version of Home Assistant

https://github.com/timmo001/system-bridge/releases/tag/4.0.4

**Reply by BigDaddyKalash47** [reply]
i have updated HA but it still doesnt work and just fails to connect :(

**Comment by julianrinaldi** [comment]
I just upgraded to 2024.4.0b0 and System Bridge 4.04, and it times out while trying to setup the integration.

**Comment by timmo001** [comment]
Do you have any firewalls blocking connections anywhere? Not sure what could be causing this

**Reply by BigDaddyKalash47** [reply]
i dont think it is firewall. here is the backend log.
Also it keeps trying to access D:, F:, K:, D: is dvd drive and the rest arent actual drives i think it is SD to usb converter.

```
2024-03-29 17:09:35 INFO (MainThread) [systembridgebackend.Application] System Bridge 4.0.4: Startup
2024-03-29 17:09:35 INFO (MainThread) [systembridgebackend.Application] Your token is: 4e4c6150-c94a-4ec4-8698-284a0f4a318f
2024-03-29 17:09:35 INFO (MainThread) [systembridgebackend.server.Server] Setup API app
2024-03-29 17:09:35 INFO (MainThread) [systembridgebackend.server.Server] Autostart enabled: False
2024-03-29 17:09:35 INFO (MainThread) [systembridgebackend.server.Server] Setup API server
2024-03-29 17:09:35 INFO (MainThread) [systembridgebackend.server.Server] Server initialised
2024-03-29 17:09:35 INFO (MainThread) [systembridgebackend.server.Server] Start server
2024-03-29 17:09:35 INFO (MainThread) [systembridgebackend.handlers.data.DataUpdate] Starting update data thread..
2024-03-29 17:09:35 INFO (MainThread) [systembridgebackend.handlers.data.DataUpdate] Starting update media thread..
2024-03-29 17:09:35 INFO (Thread-2 (_run)) [systembridgebackend.handlers.threads.data.DataUpdateThread] Update took 0 seconds
2024-03-29 17:09:35 INFO (Thread-1) [systembridgebackend.handlers.threads.data.DataUpdateThread] Started update thread
2024-03-29 17:09:35 INFO (Thread-2 (_run)) [systembridgebackend.handlers.threads.data.DataUpdateThread] Scheduled next update for: 2024-03-29 17:10:05.856780
2024-03-29 17:09:35 INFO (Thread-2 (_run)) [systembridgebackend.modules.ModulesUpdate] Update data
2024-03-29 17:09:36 INFO (MainThread) [systembridgebackend.server.Server] Open GUI: main
2024-03-29 17:09:36 INFO (Thread-4 (_run)) [systembridgebackend.handlers.threads.media.MediaUpdateThread] Update took 0 seconds
2024-03-29 17:09:36 INFO (Thread-3) [systembridgebackend.handlers.threads.media.MediaUpdateThread] Started update thread
2024-03-29 17:09:36 INFO (MainThread) [systembridgebackend.server.Server] Launch Main GUI as a detached process
2024-03-29 17:09:36 INFO (Thread-4 (_run)) [systembridgebackend.handlers.threads.media.MediaUpdateThread] Scheduled next update for: 2024-03-29 17:09:56.084780
2024-03-29 17:09:36 INFO (Thread-4 (_run)) [systembridgebackend.modules.media.Media] Updating media data
2024-03-29 17:09:36 INFO (Thread-4 (_run)) [systembridgebackend.modules.listeners.Listeners] Refresh data by module: media
2024-03-29 17:09:36 INFO (Thread-4 (_run)) [systembridgebackend.handlers.threads.media.MediaUpdateThread] Updated update interval to: 5
2024-03-29 17:09:36 INFO (Thread-4 (_run)) [systembridgebackend.handlers.threads.media.MediaUpdateThread] Update finished, next run will be at: 2024-03-29 17:09:56.084780
2024-03-29 17:09:36 INFO (Thread-4 (_run)) [systembridgebackend.handlers.threads.media.MediaUpdateThread] Waiting for next update in 19.95 seconds
2024-03-29 17:09:36 INFO (MainThread) [uvicorn.error] Started server process [4164]
2024-03-29 17:09:36 INFO (MainThread) [uvicorn.error] Waiting for application startup.
2024-03-29 17:09:36 INFO (MainThread) [systembridgebackend.server.Server] Register hotkeys
2024-03-29 17:09:36 INFO (MainThread) [systembridgebackend.server.Server] Found 0 hotkeys
2024-03-29 17:09:36 INFO (MainThread) [systembridgebackend.handlers.gui.GUI] Starting GUI thread: main
2024-03-29 17:09:36 INFO (MainThread) [uvicorn.error] Application startup complete.
2024-03-29 17:09:36 INFO (Thread-5) [systembridgebackend.handlers.threads.gui.GUIThread] Starting GUI: ['C:\\Users\\hasse\\Desktop\\New folder\\systembridge\\systembridge.exe', 'gui', 'main']
2024-03-29 17:09:36 INFO (MainThread) [uvicorn.error] Uvicorn running on http://0.0.0.0:9170 (Press CTRL+C to quit)
2024-03-29 17:09:36 INFO (Thread-5) [systembridgebackend.handlers.threads.gui.GUIThread] GUI started with PID: 15504
2024-03-29 17:09:46 INFO (Thread-2 (_run)) [systembridgebackend.modules.listeners.Listeners] Refresh data by module: sensors
2024-03-29 17:09:46 INFO (Thread-2 (_run)) [systembridgebackend.modules.ModulesUpdate] Request update module: system
2024-03-29 17:09:47 INFO (Thread-2 (_run)) [systembridgebackend.modules.system.SystemUpdate] Get latest version from GitHub
2024-03-29 17:09:47 INFO (Thread-2 (_run)) [systembridgebackend.modules.ModulesUpdate] Request update module: battery
2024-03-29 17:09:48 INFO (Thread-2 (_run)) [systembridgebackend.modules.listeners.Listeners] Refresh data by module: battery
2024-03-29 17:09:48 INFO (Thread-2 (_run)) [systembridgebackend.modules.listeners.Listeners] Refresh data by module: system
2024-03-29 17:09:48 INFO (Thread-2 (_run)) [systembridgebackend.modules.ModulesUpdate] Request update module: cpu
2024-03-29 17:09:53 INFO (Thread-2 (_run)) [systembridgebackend.modules.listeners.Listeners] Refresh data by module: cpu
2024-03-29 17:09:53 INFO (Thread-2 (_run)) [systembridgebackend.modules.ModulesUpdate] Request update module: disks
2024-03-29 17:09:53 ERROR (Thread-2 (_run)) [systembridgebackend.modules.disks.DisksUpdate] PermissionError
Traceback (most recent call last):
  File "systembridgebackend\modules\disks.py", line 39, in _get_usage
    return disk_usage(path)
           ^^^^^^^^^^^^^^^^
  File "psutil\__init__.py", line 2049, in disk_usage
  File "psutil\_pswindows.py", line 291, in disk_usage
PermissionError: [WinError 21] The device is not ready: 'D:\\'
2024-03-29 17:09:53 ERROR (Thread-2 (_run)) [systembridgebackend.modules.disks.DisksUpdate] PermissionError
Traceback (most recent call last):
  File "systembridgebackend\modules\disks.py", line 39, in _get_usage
    return disk_usage(path)
           ^^^^^^^^^^^^^^^^
  File "psutil\__init__.py", line 2049, in disk_usage
  File "psutil\_pswindows.py", line 291, in disk_usage
PermissionError: [WinError 21] The device is not ready: 'F:\\'
2024-03-29 17:09:53 ERROR (Thread-2 (_run)) [systembridgebackend.modules.disks.DisksUpdate] PermissionError
Traceback (most recent call last):
  File "systembridgebackend\modules\disks.py", line 39, in _get_usage
    return disk_usage(path)
           ^^^^^^^^^^^^^^^^
  File "psutil\__init__.py", line 2049, in disk_usage
  File "psutil\_pswindows.py", line 291, in disk_usage
PermissionError: [WinError 21] The device is not ready: 'K:\\'
2024-03-29 17:09:53 INFO (Thread-2 (_run)) [systembridgebackend.modules.listeners.Listeners] Refresh data by module: disks
2024-03-29 17:09:54 INFO (Thread-2 (_run)) [systembridgebackend.modules.ModulesUpdate] Request update module: displays
2024-03-29 17:09:54 INFO (Thread-2 (_run)) [systembridgebackend.modules.listeners.Listeners] Refresh data by module: displays
2024-03-29 17:09:55 INFO (Thread-2 (_run)) [systembridgebackend.modules.ModulesUpdate] Request update module: gpus
2024-03-29 17:09:55 INFO (Thread-2 (_run)) [systembridgebackend.modules.listeners.Listeners] Refresh data by module: gpus
2024-03-29 17:09:56 INFO (Thread-4 (_run)) [systembridgebackend.handlers.threads.media.MediaUpdateThread] Update took 0 seconds
2024-03-29 17:09:56 INFO (Thread-4 (_run)) [systembridgebackend.handlers.threads.media.MediaUpdateThread] Scheduled next update for: 2024-03-29 17:10:01.086002
2024-03-29 17:09:56 INFO (Thread-4 (_run)) [systembridgebackend.modules.media.Media] Updating media data
2024-03-29 17:09:56 INFO (Thread-4 (_run)) [systembridgebackend.modules.listeners.Listeners] Refresh data by module: media
2024-03-29 17:09:56 INFO (Thread-4 (_run)) [systembridgebackend.handlers.threads.media.MediaUpdateThread] Update finished, next run will be at: 2024-03-29 17:10:01.086002
2024-03-29 17:09:56 INFO (Thread-4 (_run)) [systembridgebackend.handlers.threads.media.MediaUpdateThread] Waiting for next update in 4.99 seconds
2024-03-29 17:09:56 INFO (Thread-2 (_run)) [systembridgebackend.modules.ModulesUpdate] Request update module: memory
2024-03-29 17:09:56 INFO (Thread-2 (_run)) [systembridgebackend.modules.listeners.Listeners] Refresh data by module: memory
2024-03-29 17:09:57 INFO (Thread-2 (_run)) [systembridgebackend.modules.ModulesUpdate] Request update module: networks
2024-03-29 17:09:57 INFO (Thread-2 (_run)) [systembridgebackend.modules.listeners.Listeners] Refresh data by module: networks
2024-03-29 17:09:58 INFO (Thread-2 (_run)) [systembridgebackend.modules.ModulesUpdate] Request update module: processes
2024-03-29 17:09:59 INFO (Thread-2 (_run)) [systembridgebackend.modules.listeners.Listeners] Refresh data by module: processes
2024-03-29 17:09:59 INFO (Thread-2 (_run)) [systembridgebackend.modules.ModulesUpdate] Data update tasks started
2024-03-29 17:09:59 INFO (Thread-2 (_run)) [systembridgebackend.handlers.threads.data.DataUpdateThread] Update finished, next run will be at: 2024-03-29 17:10:05.856780
2024-03-29 17:09:59 INFO (Thread-2 (_run)) [systembridgebackend.handlers.threads.data.DataUpdateThread] Waiting for next update in 5.99 seconds
2024-03-29 17:10:01 INFO (Thread-4 (_run)) [systembridgebackend.handlers.threads.media.MediaUpdateThread] Update took 0 seconds
2024-03-29 17:10:01 INFO (Thread-4 (_run)) [systembridgebackend.handlers.threads.media.MediaUpdateThread] Scheduled next update for: 2024-03-29 17:10:06.087373
2024-03-29 17:10:01 INFO (Thread-4 (_run)) [systembridgebackend.modules.media.Media] Updating media data
2024-03-29 17:10:01 INFO (Thread-4 (_run)) [systembridgebackend.modules.listeners.Listeners] Refresh data by module: media
2024-03-29 17:10:01 INFO (Thread-4 (_run)) [systembridgebackend.handlers.threads.media.MediaUpdateThread] Update finished, next run will be at: 2024-03-29 17:10:06.087373
2024-03-29 17:10:01 INFO (Thread-4 (_run)) [systembridgebackend.handlers.threads.media.MediaUpdateThread] Waiting for next update in 4.99 seconds
2024-03-29 17:10:05 INFO (Thread-2 (_run)) [systembridgebackend.handlers.threads.data.DataUpdateThread] Update took 0 seconds
2024-03-29 17:10:05 INFO (Thread-2 (_run)) [systembridgebackend.handlers.threads.data.DataUpdateThread] Scheduled next update for: 2024-03-29 17:10:35.857871
2024-03-29 17:10:05 INFO (Thread-2 (_run)) [systembridgebackend.modules.ModulesUpdate] Update data
2024-03-29 17:10:06 INFO (Thread-4 (_run)) [systembridgebackend.handlers.threads.media.MediaUpdateThread] Update took 0 seconds
2024-03-29 17:10:06 INFO (Thread-4 (_run)) [systembridgebackend.handlers.threads.media.MediaUpdateThread] Scheduled next update for: 2024-03-29 17:10:11.088650
2024-03-29 17:10:06 INFO (Thread-4 (_run)) [systembridgebackend.modules.media.Media] Updating media data
2024-03-29 17:10:06 INFO (Thread-4 (_run)) [systembridgebackend.modules.listeners.Listeners] Refresh data by module: media
2024-03-29 17:10:06 INFO (Thread-4 (_run)) [systembridgebackend.handlers.threads.media.MediaUpdateThread] Update finished, next run will be at: 2024-03-29 17:10:11.088650
2024-03-29 17:10:06 INFO (Thread-4 (_run)) [systembridgebackend.handlers.threads.media.MediaUpdateThread] Waiting for next update in 4.99 seconds
2024-03-29 17:10:11 INFO (Thread-4 (_run)) [systembridgebackend.handlers.threads.media.MediaUpdateThread] Update took 0 seconds
2024-03-29 17:10:11 INFO (Thread-4 (_run)) [systembridgebackend.handlers.threads.media.MediaUpdateThread] Scheduled next update for: 2024-03-29 17:10:16.089697
2024-03-29 17:10:11 INFO (Thread-4 (_run)) [systembridgebackend.modules.media.Media] Updating media data
2024-03-29 17:10:11 INFO (Thread-4 (_run)) [systembridgebackend.modules.listeners.Listeners] Refresh data by module: media
2024-03-29 17:10:11 INFO (Thread-4 (_run)) [systembridgebackend.handlers.threads.media.MediaUpdateThread] Update finished, next run will be at: 2024-03-29 17:10:16.089697
2024-03-29 17:10:11 INFO (Thread-4 (_run)) [systembridgebackend.handlers.threads.media.MediaUpdateThread] Waiting for next update in 4.99 seconds
2024-03-29 17:10:14 INFO (Thread-2 (_run)) [systembridgebackend.modules.listeners.Listeners] Refresh data by module: sensors
2024-03-29 17:10:14 INFO (Thread-2 (_run)) [systembridgebackend.modules.ModulesUpdate] Request update module: system
2024-03-29 17:10:15 INFO (Thread-2 (_run)) [systembridgebackend.modules.system.SystemUpdate] Get latest version from GitHub
2024-03-29 17:10:15 INFO (Thread-2 (_run)) [systembridgebackend.modules.listeners.Listeners] Refresh data by module: system
2024-03-29 17:10:15 INFO (Thread-2 (_run)) [systembridgebackend.modules.ModulesUpdate] Request update module: battery
2024-03-29 17:10:15 INFO (Thread-2 (_run)) [systembridgebackend.modules.listeners.Listeners] Refresh data by module: battery
2024-03-29 17:10:16 INFO (Thread-4 (_run)) [systembridgebackend.handlers.threads.media.MediaUpdateThread] Update took 0 seconds
2024-03-29 17:10:16 INFO (Thread-4 (_run)) [systembridgebackend.handlers.threads.media.MediaUpdateThread] Scheduled next update for: 2024-03-29 17:10:21.090954
2024-03-29 17:10:16 INFO (Thread-4 (_run)) [systembridgebackend.modules.media.Media] Updating media data
2024-03-29 17:10:16 INFO (Thread-4 (_run)) [systembridgebackend.modules.listeners.Listeners] Refresh data by module: media
2024-03-29 17:10:16 INFO (Thread-4 (_run)) [systembridgebackend.handlers.threads.media.MediaUpdateThread] Update finished, next run will be at: 2024-03-29 17:10:21.090954
2024-03-29 17:10:16 INFO (Thread-4 (_run)) [systembridgebackend.handlers.threads.media.MediaUpdateThread] Waiting for next update in 4.99 seconds
2024-03-29 17:10:16 INFO (Thread-2 (_run)) [systembridgebackend.modules.ModulesUpdate] Request update module: cpu
2024-03-29 17:10:20 INFO (Thread-2 (_run)) [systembridgebackend.modules.listeners.Listeners] Refresh data by module: cpu
2024-03-29 17:10:20 INFO (Thread-2 (_run)) [systembridgebackend.modules.ModulesUpdate] Request update module: disks
2024-03-29 17:10:20 ERROR (Thread-2 (_run)) [systembridgebackend.modules.disks.DisksUpdate] PermissionError
Traceback (most recent call last):
  File "systembridgebackend\modules\disks.py", line 39, in _get_usage
    return disk_usage(path)
           ^^^^^^^^^^^^^^^^
  File "psutil\__init__.py", line 2049, in disk_usage
  File "psutil\_pswindows.py", line 291, in disk_usage
PermissionError: [WinError 21] The device is not ready: 'D:\\'
2024-03-29 17:10:20 ERROR (Thread-2 (_run)) [systembridgebackend.modules.disks.DisksUpdate] PermissionError
Traceback (most recent call last):
  File "systembridgebackend\modules\disks.py", line 39, in _get_usage
    return disk_usage(path)
           ^^^^^^^^^^^^^^^^
  File "psutil\__init__.py", line 2049, in disk_usage
  File "psutil\_pswindows.py", line 291, in disk_usage
PermissionError: [WinError 21] The device is not ready: 'F:\\'
2024-03-29 17:10:20 ERROR (Thread-2 (_run)) [systembridgebackend.modules.disks.DisksUpdate] PermissionError
Traceback (most recent call last):
  File "systembridgebackend\modules\disks.py", line 39, in _get_usage
    return disk_usage(path)
           ^^^^^^^^^^^^^^^^
  File "psutil\__init__.py", line 2049, in disk_usage
  File "psutil\_pswindows.py", line 291, in disk_usage
PermissionError: [WinError 21] The device is not ready: 'K:\\'
2024-03-29 17:10:20 INFO (Thread-2 (_run)) [systembridgebackend.modules.listeners.Listeners] Refresh data by module: disks
2024-03-29 17:10:21 INFO (Thread-4 (_run)) [systembridgebackend.handlers.threads.media.MediaUpdateThread] Update took 0 seconds
2024-03-29 17:10:21 INFO (Thread-4 (_run)) [systembridgebackend.handlers.threads.media.MediaUpdateThread] Scheduled next update for: 2024-03-29 17:10:26.092262
2024-03-29 17:10:21 INFO (Thread-4 (_run)) [systembridgebackend.modules.media.Media] Updating media data
2024-03-29 17:10:21 INFO (Thread-4 (_run)) [systembridgebackend.modules.listeners.Listeners] Refresh data by module: media
2024-03-29 17:10:21 INFO (Thread-4 (_run)) [systembridgebackend.handlers.threads.media.MediaUpdateThread] Update finished, next run will be at: 2024-03-29 17:10:26.092262
2024-03-29 17:10:21 INFO (Thread-4 (_run)) [systembridgebackend.handlers.threads.media.MediaUpdateThread] Waiting for next update in 4.99 seconds
2024-03-29 17:10:21 INFO (Thread-2 (_run)) [systembridgebackend.modules.ModulesUpdate] Request update module: displays
2024-03-29 17:10:21 INFO (Thread-2 (_run)) [systembridgebackend.modules.listeners.Listeners] Refresh data by module: displays
2024-03-29 17:10:22 INFO (Thread-2 (_run)) [systembridgebackend.modules.ModulesUpdate] Request update module: gpus
2024-03-29 17:10:22 INFO (Thread-2 (_run)) [systembridgebackend.modules.listeners.Listeners] Refresh data by module: gpus
2024-03-29 17:10:23 INFO (Thread-2 (_run)) [systembridgebackend.modules.ModulesUpdate] Request update module: memory
2024-03-29 17:10:23 INFO (Thread-2 (_run)) [systembridgebackend.modules.listeners.Listeners] Refresh data by module: memory
2024-03-29 17:10:24 INFO (Thread-2 (_run)) [systembridgebackend.modules.ModulesUpdate] Request update module: networks
2024-03-29 17:10:24 INFO (Thread-2 (_run)) [systembridgebackend.modules.listeners.Listeners] Refresh data by module: networks
2024-03-29 17:10:25 INFO (Thread-2 (_run)) [systembridgebackend.modules.ModulesUpdate] Request update module: processes
2024-03-29 17:10:26 INFO (Thread-4 (_run)) [systembridgebackend.handlers.threads.media.MediaUpdateThread] Update took 0 seconds
2024-03-29 17:10:26 INFO (Thread-4 (_run)) [systembridgebackend.handlers.threads.media.MediaUpdateThread] Scheduled next update for: 2024-03-29 17:10:31.165580
2024-03-29 17:10:26 INFO (Thread-4 (_run)) [systembridgebackend.modules.media.Media] Updating media data
2024-03-29 17:10:26 INFO (Thread-4 (_run)) [systembridgebackend.modules.listeners.Listeners] Refresh data by module: media
2024-03-29 17:10:26 INFO (Thread-4 (_run)) [systembridgebackend.handlers.threads.media.MediaUpdateThread] Update finished, next run will be at: 2024-03-29 17:10:31.165580
2024-03-29 17:10:26 INFO (Thread-4 (_run)) [systembridgebackend.handlers.threads.media.MediaUpdateThread] Waiting for next update in 4.35 seconds
2024-03-29 17:10:27 INFO (Thread-2 (_run)) [systembridgebackend.modules.listeners.Listeners] Refresh data by module: processes
2024-03-29 17:10:27 INFO (Thread-2 (_run)) [systembridgebackend.modules.ModulesUpdate] Data update tasks started
2024-03-29 17:10:27 INFO (Thread-2 (_run)) [systembridgebackend.handlers.threads.data.DataUpdateThread] Update finished, next run will be at: 2024-03-29 17:10:35.857871
2024-03-29 17:10:27 INFO (Thread-2 (_run)) [systembridgebackend.handlers.threads.data.DataUpdateThread] Waiting for next update in 8.73 seconds
2024-03-29 17:10:31 INFO (Thread-4 (_run)) [systembridgebackend.handlers.threads.media.MediaUpdateThread] Update took 0 seconds
2024-03-29 17:10:31 INFO (Thread-4 (_run)) [systembridgebackend.handlers.threads.media.MediaUpdateThread] Scheduled next update for: 2024-03-29 17:10:36.275043
2024-03-29 17:10:31 INFO (Thread-4 (_run)) [systembridgebackend.modules.media.Media] Updating media data
2024-03-29 17:10:31 INFO (Thread-4 (_run)) [systembridgebackend.modules.listeners.Listeners] Refresh data by module: media
2024-03-29 17:10:31 INFO (Thread-4 (_run)) [systembridgebackend.handlers.threads.media.MediaUpdateThread] Update finished, next run will be at: 2024-03-29 17:10:36.275043
2024-03-29 17:10:31 INFO (Thread-4 (_run)) [systembridgebackend.handlers.threads.media.MediaUpdateThread] Waiting for next update in 4.98 seconds
2024-03-29 17:10:35 INFO (Thread-2 (_run)) [systembridgebackend.handlers.threads.data.DataUpdateThread] Update took 0 seconds
2024-03-29 17:10:35 INFO (Thread-2 (_run)) [systembridgebackend.handlers.threads.data.DataUpdateThread] Scheduled next update for: 2024-03-29 17:11:05.859657
2024-03-29 17:10:35 INFO (Thread-2 (_run)) [systembridgebackend.modules.ModulesUpdate] Update data
2024-03-29 17:10:36 INFO (Thread-4 (_run)) [systembridgebackend.handlers.threads.media.MediaUpdateThread] Update took 0 seconds
2024-03-29 17:10:36 INFO (Thread-4 (_run)) [systembridgebackend.handlers.threads.media.MediaUpdateThread] Scheduled next update for: 2024-03-29 17:10:41.276654
2024-03-29 17:10:36 INFO (Thread-4 (_run)) [systembridgebackend.modules.media.Media] Updating media data
2024-03-29 17:10:36 INFO (Thread-4 (_run)) [systembridgebackend.modules.listeners.Listeners] Refresh data by module: media
2024-03-29 17:10:36 INFO (Thread-4 (_run)) [systembridgebackend.handlers.threads.media.MediaUpdateThread] Update finished, next run will be at: 2024-03-29 17:10:41.276654
2024-03-29 17:10:36 INFO (Thread-4 (_run)) [systembridgebackend.handlers.threads.media.MediaUpdateThread] Waiting for next update in 4.99 seconds
2024-03-29 17:10:41 INFO (Thread-4 (_run)) [systembridgebackend.handlers.threads.media.MediaUpdateThread] Update took 0 seconds
2024-03-29 17:10:41 INFO (Thread-4 (_run)) [systembridgebackend.handlers.threads.media.MediaUpdateThread] Scheduled next update for: 2024-03-29 17:10:46.278324
2024-03-29 17:10:41 INFO (Thread-4 (_run)) [systembridgebackend.modules.media.Media] Updating media data
2024-03-29 17:10:41 INFO (Thread-4 (_run)) [systembridgebackend.modules.listeners.Listeners] Refresh data by module: media
2024-03-29 17:10:41 INFO (Thread-4 (_run)) [systembridgebackend.handlers.threads.media.MediaUpdateThread] Update finished, next run will be at: 2024-03-29 17:10:46.278324
2024-03-29 17:10:41 INFO (Thread-4 (_run)) [systembridgebackend.handlers.threads.media.MediaUpdateThread] Waiting for next update in 4.99 seconds
2024-03-29 17:10:43 INFO (Thread-2 (_run)) [systembridgebackend.modules.listeners.Listeners] Refresh data by module: sensors
2024-03-29 17:10:43 INFO (Thread-2 (_run)) [systembridgebackend.modules.ModulesUpdate] Request update module: system
2024-03-29 17:10:44 INFO (Thread-2 (_run)) [systembridgebackend.modules.system.SystemUpdate] Get latest version from GitHub
2024-03-29 17:10:44 INFO (Thread-2 (_run)) [systembridgebackend.modules.ModulesUpdate] Request update module: battery
2024-03-29 17:10:44 INFO (Thread-2 (_run)) [systembridgebackend.modules.listeners.Listeners] Refresh data by module: battery
2024-03-29 17:10:44 INFO (Thread-2 (_run)) [systembridgebackend.modules.listeners.Listeners] Refresh data by module: system
2024-03-29 17:10:45 INFO (Thread-2 (_run)) [systembridgebackend.modules.ModulesUpdate] Request update module: cpu
2024-03-29 17:10:46 INFO (Thread-4 (_run)) [systembridgebackend.handlers.threads.media.MediaUpdateThread] Update took 0 seconds
2024-03-29 17:10:46 INFO (Thread-4 (_run)) [systembridgebackend.handlers.threads.media.MediaUpdateThread] Scheduled next update for: 2024-03-29 17:10:51.279547
2024-03-29 17:10:46 INFO (Thread-4 (_run)) [systembridgebackend.modules.media.Media] Updating media data
2024-03-29 17:10:46 INFO (Thread-4 (_run)) [systembridgebackend.modules.listeners.Listeners] Refresh data by module: media
2024-03-29 17:10:46 INFO (Thread-4 (_run)) [systembridgebackend.handlers.threads.media.MediaUpdateThread] Update finished, next run will be at: 2024-03-29 17:10:51.279547
2024-03-29 17:10:46 INFO (Thread-4 (_run)) [systembridgebackend.handlers.threads.media.MediaUpdateThread] Waiting for next update in 4.99 seconds
2024-03-29 17:10:49 INFO (Thread-2 (_run)) [systembridgebackend.modules.listeners.Listeners] Refresh data by module: cpu
2024-03-29 17:10:49 INFO (Thread-2 (_run)) [systembridgebackend.modules.ModulesUpdate] Request update module: disks
2024-03-29 17:10:49 ERROR (Thread-2 (_run)) [systembridgebackend.modules.disks.DisksUpdate] PermissionError
Traceback (most recent call last):
  File "systembridgebackend\modules\disks.py", line 39, in _get_usage
    return disk_usage(path)
           ^^^^^^^^^^^^^^^^
  File "psutil\__init__.py", line 2049, in disk_usage
  File "psutil\_pswindows.py", line 291, in disk_usage
PermissionError: [WinError 21] The device is not ready: 'D:\\'
2024-03-29 17:10:49 ERROR (Thread-2 (_run)) [systembridgebackend.modules.disks.DisksUpdate] PermissionError
Traceback (most recent call last):
  File "systembridgebackend\modules\disks.py", line 39, in _get_usage
    return disk_usage(path)
           ^^^^^^^^^^^^^^^^
  File "psutil\__init__.py", line 2049, in disk_usage
  File "psutil\_pswindows.py", line 291, in disk_usage
PermissionError: [WinError 21] The device is not ready: 'F:\\'
2024-03-29 17:10:49 ERROR (Thread-2 (_run)) [systembridgebackend.modules.disks.DisksUpdate] PermissionError
Traceback (most recent call last):
  File "systembridgebackend\modules\disks.py", line 39, in _get_usage
    return disk_usage(path)
           ^^^^^^^^^^^^^^^^
  File "psutil\__init__.py", line 2049, in disk_usage
  File "psutil\_pswindows.py", line 291, in disk_usage
PermissionError: [WinError 21] The device is not ready: 'K:\\'
2024-03-29 17:10:49 INFO (Thread-2 (_run)) [systembridgebackend.modules.listeners.Listeners] Refresh data by module: disks
2024-03-29 17:10:50 INFO (Thread-2 (_run)) [systembridgebackend.modules.ModulesUpdate] Request update module: displays
2024-03-29 17:10:50 INFO (Thread-2 (_run)) [systembridgebackend.modules.listeners.Listeners] Refresh data by module: displays
2024-03-29 17:10:51 INFO (Thread-4 (_run)) [systembridgebackend.handlers.threads.media.MediaUpdateThread] Update took 0 seconds
2024-03-29 17:10:51 INFO (Thread-4 (_run)) [systembridgebackend.handlers.threads.media.MediaUpdateThread] Scheduled next update for: 2024-03-29 17:10:56.282234
2024-03-29 17:10:51 INFO (Thread-4 (_run)) [systembridgebackend.modules.media.Media] Updating media data
2024-03-29 17:10:51 INFO (Thread-4 (_run)) [systembridgebackend.modules.listeners.Listeners] Refresh data by module: media
2024-03-29 17:10:51 INFO (Thread-4 (_run)) [systembridgebackend.handlers.threads.media.MediaUpdateThread] Update finished, next run will be at: 2024-03-29 17:10:56.282234
2024-03-29 17:10:51 INFO (Thread-4 (_run)) [systembridgebackend.handlers.threads.media.MediaUpdateThread] Waiting for next update in 4.97 seconds
2024-03-29 17:10:51 INFO (Thread-2 (_run)) [systembridgebackend.modules.ModulesUpdate] Request update module: gpus
2024-03-29 17:10:51 INFO (Thread-2 (_run)) [systembridgebackend.modules.listeners.Listeners] Refresh data by module: gpus
2024-03-29 17:10:52 INFO (Thread-2 (_run)) [systembridgebackend.modules.ModulesUpdate] Request update module: memory
2024-03-29 17:10:52 INFO (Thread-2 (_run)) [systembridgebackend.modules.listeners.Listeners] Refresh data by module: memory
2024-03-29 17:10:53 INFO (Thread-2 (_run)) [systembridgebackend.modules.ModulesUpdate] Request update module: networks
2024-03-29 17:10:53 INFO (Thread-2 (_run)) [systembridgebackend.modules.listeners.Listeners] Refresh data by module: networks
2024-03-29 17:10:54 INFO (Thread-2 (_run)) [systembridgebackend.modules.ModulesUpdate] Request update module: processes
2024-03-29 17:10:55 INFO (Thread-2 (_run)) [systembridgebackend.modules.listeners.Listeners] Refresh data by module: processes
2024-03-29 17:10:55 INFO (Thread-2 (_run)) [systembridgebackend.modules.ModulesUpdate] Data update tasks started
2024-03-29 17:10:55 INFO (Thread-2 (_run)) [systembridgebackend.handlers.threads.data.DataUpdateThread] Update finished, next run will be at: 2024-03-29 17:11:05.859657
2024-03-29 17:10:55 INFO (Thread-2 (_run)) [systembridgebackend.handlers.threads.data.DataUpdateThread] Waiting for next update in 10.05 seconds
2024-03-29 17:10:56 INFO (Thread-4 (_run)) [systembridgebackend.handlers.threads.media.MediaUpdateThread] Update took 0 seconds
2024-03-29 17:10:56 INFO (Thread-4 (_run)) [systembridgebackend.handlers.threads.media.MediaUpdateThread] Scheduled next update for: 2024-03-29 17:11:01.284832
2024-03-29 17:10:56 INFO (Thread-4 (_run)) [systembridgebackend.modules.media.Media] Updating media data
2024-03-29 17:10:56 INFO (Thread-4 (_run)) [systembridgebackend.modules.listeners.Listeners] Refresh data by module: media
2024-03-29 17:10:56 INFO (Thread-4 (_run)) [systembridgebackend.handlers.threads.media.MediaUpdateThread] Update finished, next run will be at: 2024-03-29 17:11:01.284832
2024-03-29 17:10:56 INFO (Thread-4 (_run)) [systembridgebackend.handlers.threads.media.MediaUpdateThread] Waiting for next update in 4.97 seconds
2024-03-29 17:10:58 INFO (MainThread) [uvicorn.error] ('192.168.0.4', 53522) - "WebSocket /api/websocket" [accepted]
2024-03-29 17:10:58 INFO (MainThread) [uvicorn.error] connection open
2024-03-29 17:10:58 INFO (MainThread) [systembridgebackend.server.websocket.WebSocketHandler] Unregistering data listener 63c4d39d-189b-4ce8-b019-0b019fa14a2c
2024-03-29 17:10:58 INFO (MainThread) [systembridgebackend.modules.listeners.Listeners] Listener not found: 63c4d39d-189b-4ce8-b019-0b019fa14a2c
2024-03-29 17:10:58 ERROR (MainThread) [uvicorn.error] Exception in ASGI application
Traceback (most recent call last):
  File "uvicorn\protocols\websockets\websockets_impl.py", line 255, in run_asgi
  File "uvicorn\middleware\proxy_headers.py", line 84, in __call__
  File "fastapi\applications.py", line 1054, in __call__
  File "starlette\applications.py", line 123, in __call__
  File "starlette\middleware\errors.py", line 151, in __call__
  File "starlette\middleware\cors.py", line 75, in __call__
  File "starlette\middleware\exceptions.py", line 62, in __call__
  File "starlette\_exception_handler.py", line 64, in wrapped_app
  File "starlette\_exception_handler.py", line 53, in wrapped_app
  File "starlette\routing.py", line 758, in __call__
  File "starlette\routing.py", line 778, in app
  File "starlette\routing.py", line 375, in handle
  File "starlette\routing.py", line 98, in app
  File "starlette\_exception_handler.py", line 64, in wrapped_app
  File "starlette\_exception_handler.py", line 53, in wrapped_app
  File "starlette\routing.py", line 96, in app
  File "fastapi\routing.py", line 348, in app
  File "systembridgebackend\server\api.py", line 217, in websocket_endpoint
    await websocket_handler.handler()
  File "systembridgebackend\server\websocket.py", line 1021, in handler
    await self._handler(listener_id)
  File "systembridgebackend\server\websocket.py", line 956, in _handler
    request = Request(**data)
              ^^^^^^^^^^^^^^^
TypeError: Request.__init__() got an unexpected keyword argument 'api_key'
2024-03-29 17:10:58 INFO (MainThread) [uvicorn.error] connection closed
2024-03-29 17:11:01 INFO (Thread-4 (_run)) [systembridgebackend.handlers.threads.media.MediaUpdateThread] Update took 0 seconds
2024-03-29 17:11:01 INFO (Thread-4 (_run)) [systembridgebackend.handlers.threads.media.MediaUpdateThread] Scheduled next update for: 2024-03-29 17:11:06.286857
2024-03-29 17:11:01 INFO (Thread-4 (_run)) [systembridgebackend.modules.media.Media] Updating media data
2024-03-29 17:11:01 INFO (Thread-4 (_run)) [systembridgebackend.modules.listeners.Listeners] Refresh data by module: media
2024-03-29 17:11:01 INFO (Thread-4 (_run)) [systembridgebackend.handlers.threads.media.MediaUpdateThread] Update finished, next run will be at: 2024-03-29 17:11:06.286857
2024-03-29 17:11:01 INFO (Thread-4 (_run)) [systembridgebackend.handlers.threads.media.MediaUpdateThread] Waiting for next update in 4.99 seconds
2024-03-29 17:11:05 INFO (Thread-2 (_run)) [systembridgebackend.handlers.threads.data.DataUpdateThread] Update took 0 seconds
2024-03-29 17:11:05 INFO (Thread-2 (_run)) [systembridgebackend.handlers.threads.data.DataUpdateThread] Scheduled next update for: 2024-03-29 17:11:35.860844
2024-03-29 17:11:05 INFO (Thread-2 (_run)) [systembridgebackend.modules.ModulesUpdate] Update data
2024-03-29 17:11:06 INFO (Thread-4 (_run)) [systembridgebackend.handlers.threads.media.MediaUpdateThread] Update took 0 seconds
2024-03-29 17:11:06 INFO (Thread-4 (_run)) [systembridgebackend.handlers.threads.media.MediaUpdateThread] Scheduled next update for: 2024-03-29 17:11:11.288344
2024-03-29 17:11:06 INFO (Thread-4 (_run)) [systembridgebackend.modules.media.Media] Updating media data
2024-03-29 17:11:06 INFO (Thread-4 (_run)) [systembridgebackend.modules.listeners.Listeners] Refresh data by module: media
2024-03-29 17:11:06 INFO (Thread-4 (_run)) [systembridgebackend.handlers.threads.media.MediaUpdateThread] Update finished, next run will be at: 2024-03-29 17:11:11.288344
2024-03-29 17:11:06 INFO (Thread-4 (_run)) [systembridgebackend.handlers.threads.media.MediaUpdateThread] Waiting for next update in 4.99 seconds
2024-03-29 17:11:11 INFO (Thread-4 (_run)) [systembridgebackend.handlers.threads.media.MediaUpdateThread] Update took 0 seconds
2024-03-29 17:11:11 INFO (Thread-4 (_run)) [systembridgebackend.handlers.threads.media.MediaUpdateThread] Scheduled next update for: 2024-03-29 17:11:16.290069
2024-03-29 17:11:11 INFO (Thread-4 (_run)) [systembridgebackend.modules.media.Media] Updating media data
2024-03-29 17:11:11 INFO (Thread-4 (_run)) [systembridgebackend.modules.listeners.Listeners] Refresh data by module: media
2024-03-29 17:11:11 INFO (Thread-4 (_run)) [systembridgebackend.handlers.threads.media.MediaUpdateThread] Update finished, next run will be at: 2024-03-29 17:11:16.290069
2024-03-29 17:11:11 INFO (Thread-4 (_run)) [systembridgebackend.handlers.threads.media.MediaUpdateThread] Waiting for next update in 4.99 seconds
2024-03-29 17:11:13 INFO (Thread-2 (_run)) [systembridgebackend.modules.listeners.Listeners] Refresh data by module: sensors
2024-03-29 17:11:13 INFO (Thread-2 (_run)) [systembridgebackend.modules.ModulesUpdate] Request update module: system
2024-03-29 17:11:14 INFO (Thread-2 (_run)) [systembridgebackend.modules.system.SystemUpdate] Get latest version from GitHub
2024-03-29 17:11:14 INFO (Thread-2 (_run)) [systembridgebackend.modules.ModulesUpdate] Request update module: battery
2024-03-29 17:11:14 INFO (Thread-2 (_run)) [systembridgebackend.modules.listeners.Listeners] Refresh data by module: battery
2024-03-29 17:11:14 INFO (Thread-2 (_run)) [systembridgebackend.modules.listeners.Listeners] Refresh data by module: system
2024-03-29 17:11:15 INFO (Thread-2 (_run)) [systembridgebackend.modules.ModulesUpdate] Request update module: cpu
2024-03-29 17:11:16 INFO (Thread-4 (_run)) [systembridgebackend.handlers.threads.media.MediaUpdateThread] Update took 0 seconds
2024-03-29 17:11:16 INFO (Thread-4 (_run)) [systembridgebackend.handlers.threads.media.MediaUpdateThread] Scheduled next update for: 2024-03-29 17:11:21.291905
2024-03-29 17:11:16 INFO (Thread-4 (_run)) [systembridgebackend.modules.media.Media] Updating media data
2024-03-29 17:11:16 INFO (Thread-4 (_run)) [systembridgebackend.modules.listeners.Listeners] Refresh data by module: media
2024-03-29 17:11:16 INFO (Thread-4 (_run)) [systembridgebackend.handlers.threads.media.MediaUpdateThread] Update finished, next run will be at: 2024-03-29 17:11:21.291905
2024-03-29 17:11:16 INFO (Thread-4 (_run)) [systembridgebackend.handlers.threads.media.MediaUpdateThread] Waiting for next update in 4.99 seconds

```

**Reply by boosted3svt** [reply]
Hello Timmo.

I recently learned about this system bridge app and I thought it was an awesome idea... however I must echo the above sentiment.  I am experiencing issues and it is not firewall related.

I am running HA:
**HA Core 2024.3.1
HA Frontend 20240307.0
Systembridge 4.1.5 x64**

My HA server is in the same subnet as my Windows 11 machine where system bridge is installed.
I have local windows firewall rules added to allow ALL connections from the HA server(including the default port for system bridge)
I can run a tcpdump and also use wireshark to see the connection attempts from the HA app when attempting to add the integration and I see full syn/synack/ack/push/fin flags so the communication is working.

I see the following tcpdump which proves a firewall issue is not the cause:

$ sudo tcpdump -i enp2s0 -s0 -n port 9170 
tcpdump: verbose output suppressed, use -v or -vv for full protocol decode 
listening on enp2s0, link-type EN10MB (Ethernet), capture size 262144 bytes 
12:45:30.892565 IP 192.168.1.101.60630 > 192.168.1.100.9170: Flags [S], seq 3079375936, 
12:45:30.893230 IP 192.168.1.100.9170 > 192.168.1.101.60630: Flags [S.], seq 2232248643, 
12:45:30.893278 IP 192.168.1.101.60630 > 192.168.1.100.9170: Flags [.], ack 1, win 502, 
12:45:30.895296 IP 192.168.1.101.60630 > 192.168.1.100.9170: Flags [.], ack 184, win 501,
12:45:30.898463 IP 192.168.1.100.9170 > 192.168.1.101.60630: Flags [F.], seq 184, ack 427, 
12:45:30.898728 IP 192.168.1.101.60630 > 192.168.1.100.9170: Flags [F.], seq 427, ack 185, 
12:45:30.898855 IP 192.168.1.100.9170 > 192.168.1.101.60630: Flags [.], ack 428, win 8194, 

I also see the following in wireshark:

![image](https://github.com/timmo001/system-bridge/assets/7205757/f9c6f8f3-f7a1-4c6a-9d2f-37051be5572c)


It seems that the integration is attempting to be made, but its requesting to "switch protocols" and then websockets sends a FIN (finished) packet.

As you can see, below, my wireshark capture shows the websockets payload to use "api_key", which matches dwardu89's post: https://github.com/timmo001/system-bridge/discussions/2903#discussioncomment-8829996

![image](https://github.com/timmo001/system-bridge/assets/7205757/d2a60fd3-8b29-4179-b876-f1a2318d099d)




Lastly, here are the home-assistant.log files that accompany the same attempt:

![image](https://github.com/timmo001/system-bridge/assets/7205757/5e01119d-8484-4493-b9ab-45007dab0047)



All of this points not to a firewall issue, but to the integration attempting to use "api_key" as the value it is sending which (I am only guessing) is possibly incorrect?

Thanks!

Ray H.

**Reply by timmo001** [reply, marked as answer]
Home Assistant 2024.4.0 will be released tomorrow, which contains changes to support the latest version of System Bridge. I expect that both of your issues may have already been fixed in the latest version of System Bridge (4.1.5) and Home Assistant (2024.4.0).

**Reply by boosted3svt** [reply]
Hello Mr Timmo!

I wanted to confirm to you that HA 2024.4.0 was just released, and the update to this corrected the inability to add the integration.   Thank you for your assistance and guidance in the upcoming release and date!
